{
  "KO6_cancellation": {
    "D1_sector_norms": {
      "Pi_minus": "1",
      "Pi_plus": "1",
      "Pi_zero": "0"
    },
    "all_odd_traces_vanish": true,
    "grading_relation": "Gamma96 D_phys(t) Gamma96=-D_phys(t)",
    "mechanism": "equal KO6 partner contributions cancel in J0 and add in J0^2",
    "repair_quadratic_pullback": "8",
    "sampled_odd_moments": {
      "-1": {
        "1": "0",
        "3": "0",
        "5": "0",
        "7": "0"
      },
      "0": {
        "1": "0",
        "3": "0",
        "5": "0",
        "7": "0"
      },
      "1": {
        "1": "0",
        "3": "0",
        "5": "0",
        "7": "0"
      },
      "1/2": {
        "1": "0",
        "3": "0",
        "5": "0",
        "7": "0"
      },
      "3/2": {
        "1": "0",
        "3": "0",
        "5": "0",
        "7": "0"
      }
    },
    "sampled_t_values": [
      "-1",
      "0",
      "1/2",
      "1",
      "3/2"
    ],
    "signed_action_pullback": "S_sig(D_phys(t))=0",
    "signed_quadratic_pullback": "0"
  },
  "Morse_Bott_decomposition": {
    "finite_Morse_Bott": true,
    "negative_normal_dimension": 2304,
    "normal_negative": "Ran(Pi_minus)",
    "normal_positive": "Ran(Pi_plus)",
    "orbit": "U(96)/(U(48) x U(48))",
    "positive_normal_dimension": 2304,
    "tangent": "Ran(Pi_zero)=ker J0",
    "tangent_real_dimension": 4608
  },
  "action_tier_reconciliation": {
    "CBF_T25": "fermion/Yukawa spinor action remains distinct and unaffected",
    "CBF_T28": "positive repair semigroup is the exact normal-square shadow",
    "H4_T10": "finite trace-cubic transgression only; no q79 Maurer-Cartan identification",
    "H4_T15": "field-only finite action exists; physical BV compactification gate remains open",
    "H4_T9": "direct variational branch instantiated for F(D)=D^2-I96",
    "physical_pairing_or_polarization_required": true
  },
  "automorphism_transfer": {
    "Hessian_intertwiner": "J_(UDU^*) Ad_U=Ad_U J_D",
    "action_invariant": "S_sig(UDU^*)=S_sig(D)",
    "continuum_q79_transfer_closed": false,
    "finite_operator_space_closed": true,
    "group": "U(96)",
    "residual_covariant": "F(UDU^*)=UF(D)U^*"
  },
  "canonical_two_anchor_classification": {
    "Hessian_eigenvalues": {
      "Pi_minus": "2(-a+b)",
      "Pi_plus": "2(a+b)",
      "Pi_zero": "2b/3"
    },
    "all_exact_square_solutions_cancel": true,
    "all_noncancelling_members_change_residual_or_zero_modes": true,
    "class": "S_(a,b)=aS_sig+bS_0",
    "exact_square_solutions": [
      {
        "a": -1,
        "b": 0
      },
      {
        "a": 1,
        "b": 0
      }
    ],
    "family_pullback": "b(2t^2-(8/9)t^3)",
    "normal_square_equations": [
      "(a+b)^2=1",
      "(-a+b)^2=1",
      "b=0"
    ],
    "scope": "canonical anchors emitted by I96 and D0 only"
  },
  "check_summary": {
    "failed": [],
    "passed": 148,
    "total": 148
  },
  "checks": {
    "D0_is_self_adjoint": true,
    "D0_minus_rank_is_48": true,
    "D0_plus_rank_is_48": true,
    "D0_square_is_identity": true,
    "D0_trace_is_zero": true,
    "D1_has_no_zero_sector": true,
    "D1_minus_norm_is_one": true,
    "D1_plus_norm_is_one": true,
    "D1_signed_Hessian_decomposes": true,
    "D1_signed_Hessian_square_is_repair_Hessian": true,
    "D1_three_projectors_are_pairwise_orthogonal": true,
    "D1_three_projectors_resolve": true,
    "H_phys_matches_T23": true,
    "H_phys_signed_Hessian_decomposes": true,
    "H_phys_signed_Hessian_square_is_repair_Hessian": true,
    "H_phys_three_projectors_are_pairwise_orthogonal": true,
    "H_phys_three_projectors_resolve": true,
    "Hessian_is_conjugation_covariant": true,
    "KO6_cancellation_is_newly_closed": true,
    "T20_source_is_exact": true,
    "T23_response_is_exact": true,
    "T26_repair_action_is_exact": true,
    "T27_spectral_classification_is_exact": true,
    "T28_operator_repair_is_exact": true,
    "canonical_two_anchor_no_go_is_newly_closed": true,
    "contract_schema_is_exact": true,
    "critical_locus_rejects_zero_operator": true,
    "cyclic_permutation_is_unitary": true,
    "direct_signed_action_is_newly_closed": true,
    "exact_square_members_cancel_on_family": true,
    "family_0_is_KO6_odd": true,
    "family_0_odd_moment_1_vanishes": true,
    "family_0_odd_moment_3_vanishes": true,
    "family_0_odd_moment_5_vanishes": true,
    "family_0_odd_moment_7_vanishes": true,
    "family_0_signed_action_cancels": true,
    "family_0_weighted_action_matches_polynomial": true,
    "family_1_is_KO6_odd": true,
    "family_1_odd_moment_1_vanishes": true,
    "family_1_odd_moment_3_vanishes": true,
    "family_1_odd_moment_5_vanishes": true,
    "family_1_odd_moment_7_vanishes": true,
    "family_1_over_2_is_KO6_odd": true,
    "family_1_over_2_odd_moment_1_vanishes": true,
    "family_1_over_2_odd_moment_3_vanishes": true,
    "family_1_over_2_odd_moment_5_vanishes": true,
    "family_1_over_2_odd_moment_7_vanishes": true,
    "family_1_over_2_signed_action_cancels": true,
    "family_1_over_2_weighted_action_matches_polynomial": true,
    "family_1_signed_action_cancels": true,
    "family_1_weighted_action_matches_polynomial": true,
    "family_3_over_2_is_KO6_odd": true,
    "family_3_over_2_odd_moment_1_vanishes": true,
    "family_3_over_2_odd_moment_3_vanishes": true,
    "family_3_over_2_odd_moment_5_vanishes": true,
    "family_3_over_2_odd_moment_7_vanishes": true,
    "family_3_over_2_signed_action_cancels": true,
    "family_3_over_2_weighted_action_matches_polynomial": true,
    "family_minus_1_is_KO6_odd": true,
    "family_minus_1_odd_moment_1_vanishes": true,
    "family_minus_1_odd_moment_3_vanishes": true,
    "family_minus_1_odd_moment_5_vanishes": true,
    "family_minus_1_odd_moment_7_vanishes": true,
    "family_minus_1_signed_action_cancels": true,
    "family_minus_1_weighted_action_matches_polynomial": true,
    "full_B_ACTION_01_remains_open": true,
    "full_operator_dimension_is_9216": true,
    "generic_signed_Hessian_decomposes": true,
    "generic_signed_Hessian_square_is_repair_Hessian": true,
    "generic_three_projectors_are_pairwise_orthogonal": true,
    "generic_three_projectors_resolve": true,
    "grading_anticommutes_with_D0": true,
    "grading_anticommutes_with_D1": true,
    "grading_is_self_adjoint": true,
    "grading_square_is_identity": true,
    "handoff_is_pinned": true,
    "held_out_observable_remains_open": true,
    "kernel_model_is_pinned": true,
    "material_projectors_are_orthogonal": true,
    "material_projectors_resolve_identity": true,
    "negative_inertia_is_2304": true,
    "negative_sample_has_eigenvalue_minus_two": true,
    "negative_signed_Hessian_decomposes": true,
    "negative_signed_Hessian_square_is_repair_Hessian": true,
    "negative_three_projectors_are_pairwise_orthogonal": true,
    "negative_three_projectors_resolve": true,
    "no_fitted_coefficients_used": true,
    "no_observed_values_used": true,
    "noncancelling_weighted_member_changes_zero_sector_square": true,
    "nonzero_physical_coordinate_remains_open": true,
    "orbit_commutator_equals_zero_mode": true,
    "orbit_generator_is_skew_adjoint": true,
    "physical_Lorentzian_action_remains_open": true,
    "physical_packet_acceptance_unchanged": true,
    "physical_row_acceptance_unchanged": true,
    "physical_scalar_profile_remains_open": true,
    "positive_inertia_is_2304": true,
    "positive_repair_gradient_accepts_zero_operator": true,
    "positive_sample_has_eigenvalue_plus_two": true,
    "positive_signed_Hessian_decomposes": true,
    "positive_signed_Hessian_square_is_repair_Hessian": true,
    "positive_three_projectors_are_pairwise_orthogonal": true,
    "positive_three_projectors_resolve": true,
    "repair_quadratic_matches_T28": true,
    "repair_quadratic_pullback_is_eight": true,
    "residual_is_conjugation_covariant": true,
    "signed_Hessian_inertia_is_newly_closed": true,
    "signed_Hessian_is_self_adjoint_on_probe": true,
    "signed_Hessian_square_bridge_is_newly_closed": true,
    "signed_action_directional_derivative_is_residual_pairing": true,
    "signed_action_is_conjugation_invariant": true,
    "signed_action_is_normalized_at_D0": true,
    "signed_gradient_vanishes_at_D0": true,
    "signed_quadratic_pullback_cancels": true,
    "source_01_hash_matches": true,
    "source_02_hash_matches": true,
    "source_03_hash_matches": true,
    "source_04_hash_matches": true,
    "source_05_hash_matches": true,
    "source_06_hash_matches": true,
    "source_07_hash_matches": true,
    "source_08_hash_matches": true,
    "source_09_hash_matches": true,
    "source_10_hash_matches": true,
    "source_11_hash_matches": true,
    "source_12_hash_matches": true,
    "source_13_hash_matches": true,
    "source_lock_schema_is_exact": true,
    "source_root_is_nonempty": true,
    "strict_top_level_contract": true,
    "two_anchor_exact_square_solutions_are_plus_minus_signed": true,
    "two_anchor_square_equations_force_b_zero": true,
    "weighted_Hessian_lifts_orbit_zero_mode": true,
    "weighted_Hessian_negative_sector_is_two": true,
    "weighted_Hessian_positive_sector_is_two": true,
    "weighted_Hessian_square_differs_from_repair": true,
    "weighted_Hessian_zero_sector_is_two_thirds": true,
    "weighted_action_is_normalized_at_D0": true,
    "weighted_directional_derivative_matches_gradient": true,
    "weighted_extra_stationary_point_is_not_closure": true,
    "weighted_pullback_has_extra_stationary_point": true,
    "zero_inertia_is_4608": true,
    "zero_mode_is_nonzero": true,
    "zero_sample_is_in_Hessian_kernel": true,
    "zero_signed_Hessian_decomposes": true,
    "zero_signed_Hessian_square_is_repair_Hessian": true,
    "zero_three_projectors_are_pairwise_orthogonal": true,
    "zero_three_projectors_resolve": true
  },
  "claim_id": "CBF.T29",
  "configuration_space": {
    "D0_sha256": "2fcca7a21d905865c331db9785e061249342da3ed5b0c59539a31a1a2ea72fd1",
    "D0_spectrum": {